year,sentence_id,actor,predicate,negotiation_point,predicate_type
2002,226,CROATIA,to estimate its base year emissions is neither consistent with IPCC good practice guidance,estimating its base year emissions,opposition
2002,229,GHANA,elected,William Bonsu as EGTT Chair,support
2002,229,USA,elected,Richard Bradley as EGTT Vice-Chair,support
2002,231,INDIA,supported,consideration of access to resources,support
2002,240,AUSTRALIA,stressed,future work should be policy neutral,support
2002,241,USA,conducted consultations on draft SBSTA conclusions and a draft COP decision,draft SBSTA conclusions and a draft COP decision,other
2002,255,SAUDI ARABIA,said,the G-77/China had not had enough time to consider the text fully,other
2002,262,SAUDI ARABIA,proposed,replacing all paragraphs with text noting only that SBSTA agreed to continue consideration of the issue at SBSTA-18,support
2002,263,EUROPEAN UNION,proposed making reference to,the implementation of decision 13/CP,support
2002,269,AUSTRALIA,was convened under the facilitation of,a contact group,other
2002,272,CANADA,Available,Available,other
2002,273,EUROPEAN UNION,Available,The EU,other
2002,302,EUROPEAN UNION,reaffirmed their objection to,Canada’s original proposal on accounting for cleaner energy exports,opposition
2002,303,EUROPEAN UNION,said that,only generic issues relating to trade in cleaner energy should be discussed,support
2002,310,SAUDI ARABIA,argued for,a draft decision requesting the Secretariat to analyze the adverse effects of P&Ms on developing countries,support
2002,324,CANADA,Available,Available,other
2002,325,INDIA,emphasized strengthening,the reporting process for Annex I Parties,support
2002,339,LDCs,highlighted their difficulties in developing national communications and called on the SBSTA to address financial support,developing national communications,support
2002,339,LDCs,called on the SBSTA to address financial support,address financial support,support
2002,346,G-77/CHINA,accepted,the text as a basis for discussion,support
2002,349,CANADA,stressed,"""normal"" UN procedures by which documents are seen before they are adopted",support
2002,352,AUSTRALIA,proposed,amendments,support
2002,352,JAPAN,proposed,amendments,support
2002,360,EUROPEAN UNION,called for,the initiation of a process for the voluntary review of national communications,support
2002,362,JAPAN,query,the funding for CGE meetings,support
2002,380,NORWAY,Available,Norway,other
2002,408,BHUTAN,was discussed,CAPACITY BUILDING,other
2002,410,G-77/CHINA,expressed concern,the COP-7 decision on capacity-building had not been implemented by the GEF,opposition
2002,418,G-77/CHINA,expressed concern about,the lack of financial support for implementation of the decision,opposition
2002,420,CANADA,expressed interest in supporting,the workshops,support
2002,425,LDCs,relating to,Matters,other
2002,426,BANGLADESH,highlighted,a workshop held in Dhaka that aimed to develop NAPAs,other
2002,430,COP,decides to postpone the revision of,NAPA guidelines,support
2002,430,COP,invites,the LDCs to use the annotations to the NAPA guidelines prepared by the LEG,support
2002,430,COP,decides to review,the NAPA guidelines at COP-9,support
2002,439,ITALIA,offered to host,COP-9,support
2002,443,EUROPEAN UNION,Available,The EU,other
2002,444,USA,stressed the need to ensure that its contributions were used to support,the UNFCCC process,support
2002,447,CANADA,Available,Available,other
2002,448,USA,supported,participation through new approaches,support
2002,450,EUROPEAN UNION,did not agree with,the conclusions,opposition
2002,452,SWITZERLAND,supported,a text proposed by Canada urging Parties to ensure early payment of contributions,support
2002,452,BULGARIA,supported,a text proposed by Canada urging Parties to ensure early payment of contributions,support
2002,452,CANADA,proposed,a text urging Parties to ensure early payment of contributions,support
2002,453,CANADA,requested,the Secretariat to provide its budget requirements for the activities relating to implementation of the Marrakesh Accords,support
2002,457,CROATIA,Proposal by Croatia,on LULUCF,support
2002,459,SBI,decided to continue consideration of Croatia’s request,Croatia’s request with regard to its base year for emissions calculations,support
2002,461,CROATIA,proposal on,Croatian proposal on LULUCF,support
2002,462,CROATIA,conclusions on Croatia’s base year emissions,Croatia’s base year emissions (FCCC/SBI/2002/L.,other
2002,472,ICELAND,proposal,this issue,support
2002,476,INDIA,inaugurated,the high-level segment,support
2002,482,INDIA,noted,India’s commitment to combating global climate change,other
2002,490,OPEC,reminded delegates of the need to minimize the adverse effects of policies and measures to address climate change,the need to minimize the adverse effects of policies and measures to address climate change,other
2002,490,OPEC,said that adequate provision should be made for the transfer of technology to developing countries,adequate provision should be made for the transfer of technology to developing countries,support
2002,495,INDIA,called for,an efficient and transparent policy framework,support
2002,497,INTERNATIONAL WORK GROUP FOR INDIGENOUS AFFAIRS (IWGIA),noted the vulnerability of indigenous peoples and their important role in the protection of natural resources and called for support for their participation in the UNFCCC process,support for their participation in the UNFCCC process,support
2002,501,INDIA,highlights,several concerns faced by India’s youth,other
2002,505,AOSIS,noted that,small island developing States are among those hardest hit by climate change,other
2002,506,FINLAND,stressed,the EU’s efforts to achieve tangible results and show demonstrable progress by 2005,support
2002,508,EUROPEAN UNION,called for,a common dialogue,support
2002,509,AOSIS,called for an imme,an imme,support
2002,511,REPUBLIC OF IRELAND,proposed,discussion on a fair and equitable distribution of emission targets,support
2002,514,POLAND,said,adaptation and funding for climate change must go hand-in-hand with mitigation and long-term strategies,support
2002,515,AOSIS,Available,,other
2002,517,THAILAND,Available,Thailand,other
2002,518,EUROPEAN UNION,underscored,the need for dialogue,support
2002,519,UGANDA,Available,Uganda,other
2002,520,NEPAL,underscored,the need for further research to mitigate the effects of climate change,support
2002,521,ETHIOPIA,said,economic development is crucial for adapting to climate change,support
2002,522,IRAN,stressed,minimizing losses due to adverse effects and impacts of response measures on developing countries with economies dependent on fossil fuels,support
2002,523,FINLAND,pledged support to,the LDC Fund,support
2002,523,DENMARK,pledged support to,the LDC Fund,support
2002,524,KENYA,appealed,a special fund for developing countries other than LDCs,support
2002,524,UGANDA,appealed,a special fund for developing countries other than LDCs,support
2002,526,URUGUAY,said,the lack of institutional and legal capacity was a barrier to CDM implementation,other
2002,528,SOUTH KOREA,Available,The Republic of Korea,other
2002,530,UGANDA,said,the Declaration should call for the ratification of the Protocol,support
2002,531,SWITZERLAND,supported,reference to a forward-looking approach,support
2002,532,AUSTRALIA,said,put into place a process for future global emissions reduction arrangements,support
2002,533,SOUTH KOREA,supported,a Declaration that considers the human dimension to climate change,support
2002,536,UGANDA,recalled,the Millennium Development Goals,support
2002,536,UGANDA,said,climate change “cripples” developing country economies,other
2002,538,NAMIBIA,announced its ratification of,the Protocol,support
2002,539,GREECE,Available,,other
2002,540,GERMANY,said,the EU would build a coalition of like-minded countries willing to commit themselves to timetables and targets for increasing renewable energy use,other
2002,544,KIRIBATI,underscored the need for development projects to incorporate climate change considerations,development projects to incorporate climate change considerations,support
2002,545,ISRAEL,said that it was developing,a greenhouse gas emissions reduction policy,support
2002,548,BANGLADESH,supported,a multilateral CDM programme for LDCs,support
2002,549,USA,said that its climate approach is grounded in sound economic policy,its climate approach is grounded in sound economic policy,support
2002,549,USA,noted its commitment to reduce the greenhouse gas intensity of its economy by 18% over ten years,reduce the greenhouse gas intensity of its economy by 18% over ten years,support
2002,550,USA,claimed,economic growth is the key to environmental progress,support
2002,551,GERMANY,called for,"""absolute"" emissions reductions",support
2002,553,SWEDEN,Available,Sweden,other
2002,557,CANADA,said it should consider,Available,support
2002,559,SAUDI ARABIA,said that the Declaration should be a consensus document prioritizing adaptation to climate impacts and impacts of Annex I response measures,a consensus document prioritizing adaptation to climate impacts and impacts of Annex I response measures,support
2002,561,VENEZUELA,called on the COP to address,compliance under the UNFCCC and the Marrakesh Accords,support
2002,563,EUROPEAN UNION,underscored that mitigation has proven to be a powerful force for technological change and economic development,mitigation has proven to be a powerful force for technological change and economic development,support
2002,564,ICELAND,addressed,carbon intensities and the need to stimulate the development of technologies to avoid wasteful emissions,other
2002,565,INDIA,called for,the provision of sufficient environmental “space” for developing countries to develop,support
2002,566,THAILAND,asked,Parties to differentiate between luxury and survival emissions,support
2002,568,QATAR,Available,Qatar,other
2002,571,EUROPEAN UNION,stressed,renewable energy exemplified the synergies between sustainable development and climate change,support
2002,572,CHILE,emphasized that,national strategies for sustainable development must address adaptation and mitigation policies,support
2002,574,BRAZIL,supported,projects in large cities,support
2002,575,TANZANIA,stressed,equity in the distribution of projects,support
2002,585,USA,stressed,economic growth as the key to environmental progress,support
2002,589,EUROPEAN UNION,submitted,a statement of concern regarding the Decla- ration,support
2002,591,G-77/CHINA,Available,The G-77/China,other
2002,592,CANADA,Available,Available,other
2002,594,JAPAN,noted that,COP-8 had succeeded in opening a small window of opportunity for on-going informal dialogue on future mitigation action,other
2002,595,SAUDI ARABIA,said,the Delhi Declaration was well balanced,support
2002,596,USA,praised,the US,support
2002,607,UK,introduced,a resolution expressing gratitude to the Government of India (FCCC/CP/2002/ L.,support
2002,607,UK,introduced,a resolution,support
2002,607,INDIA,adopted,a resolution expressing gratitude to the Government of India (FCCC/CP/2002/ L.,support
2002,626,USA,reportedly supported,the G-77/China position,support
2002,627,NIGERIA,received a heartfelt expression of grat- itude,a heartfelt expression of grat- itude,other
2002,631,G-77/CHINA,refused to negotiate,after a time,opposition
2002,643,G-77/CHINA,cast mitigation exclusively in terms of the implementation of existing commitments,implementation of existing commitments,support
2002,645,AUSTRALIA,introduced,a new dichotomy into the climate change negotiations last year by behaving as if the Protocol is somehow antithetical to the goals of the UNFCCC,support
2002,645,USA,introduced,a new dichotomy into the climate change negotiations last year by behaving as if the Protocol is somehow antithetical to the goals of the UNFCCC,support
2002,646,USA,reputation of the Protocol,Protocol,other
2002,648,CANADA,proposal by Canada,cleaner energy would have given it assigned amount units for the environmental benefit created by its exports to the US of cleaner energy,support
2002,650,USA,objected,a new Canadian proposal,opposition
2002,650,CANADA,proposal,a new Canadian proposal,support
2002,651,USA,objected to,stem discussion on adverse effects,opposition
2002,654,CANADA,gave no indication that this would dampen the Prime Minister’s resolve to ratify the Protocol,dampen the Prime Minister’s resolve to ratify the Protocol,other
2002,665,COP-8,can hardly be considered an overall success,COP-8,other
2002,678,ITALIA,will be held in Rome,SIXTH CONFERENCE OF THE PARTIES TO THE VIENNA CONVENTION AND 14TH MEETING OF THE PARTIES TO THE MONTREAL PROTOCOL: COP-6 and MOP-14,other
2002,691,RUSSIA,will be held in Moscow,This conference,other
2003,3,USA,are,The Sustaining Donors of the Bulletin,other
2003,79,MOROCCO,Available,Morocco,other
2003,80,ZIMBABWE,Available,Zimbabwe,other
2003,81,ITALIA,Available,Italy,other
2003,83,PAKISTAN,said,work at COP-9 must focus on capacity building,support
2003,84,LDCs,Highlighting the vulnerability of,LDCs,other
2003,92,ICELAND,was chaired by,SUBSIDIARY BODY FOR SCIENTIFIC AND TECHNOLOGICAL ADVICE (SBSTA),other
2003,94,BAHAMAS,elected,Arthur Rolle as Vice-Chair of SBSTA,support
2003,96,MALAYSIA,Available,Malaysia,other
2003,97,EUROPEAN UNION,said,SBSTA should use a wide range of approaches and methodologies,support
2003,98,JAPAN,said,the process should be based on a step-wise approach,support
2003,102,G-77/CHINA,Opposing,the G-77/China,opposition
2003,102,CHINA,Opposing,the G-77/China,opposition
2003,106,G-77/CHINA,Available,The G-77/China,other
2003,107,CHINA,Available,,other
2003,108,G-77/CHINA,Available,The G-77/China,other
2003,111,RUSSIA,emphasized,"""scientific basis of a global nature""",support
2003,123,UK,requested,to co-chair a contact group to discuss these issues,support
2003,139,NEW ZEALAND,requested,to conduct informal consultations on the matter,support
2003,162,CANADA,Available,Available,other
2003,165,AUSTRALIA,expressed concern regarding,the singling out of GMOs,support
2003,166,EUROPEAN UNION,stressed,the text was balanced and reflected progress toward implementing the Protocol,support
2003,176,ZIMBABWE,said,Margaret Mukahanana-Sangarwe (Zimbabwe) and Audun Rosland (Norway) would co-chair a contact group to develop conclusions on the GPG,other
2003,176,NORWAY,said,Margaret Mukahanana-Sangarwe (Zimbabwe) and Audun Rosland (Norway) would co-chair a contact group to develop conclusions on the GPG,other
2003,180,G-77/CHINA,highlighted,factoring out,support
2003,180,EUROPEAN UNION,highlighted,factoring out,support
2003,184,AOSIS,raised concerns over,adopting the GPG without sufficient time for its examination,opposition
2003,186,EUROPEAN UNION,recommended,recording Tuvalu’s concerns in the meeting’s minutes instead of amending the draft conclusions,support
2003,201,USA,proposed,accounting for exports and imports separately,support
2003,216,GHANA,Available,William Kojo Agye- mang-Bonsu,other
2003,217,TRINIDAD AND TOBAGO,requested,co-chair a contact group on the EGTT’s programme of work and related issues,support
2003,217,UK,requested,co-chair a contact group on the EGTT’s programme of work and related issues,support
2003,237,EUROPEAN UNION,emphasized,the importance of historical data sets,support
2003,238,AUSTRALIA,said,Sue Barrell (Australia) and Philip Gwage (Uganda) would co-chair a contact group,other
2003,238,UGANDA,said,Sue Barrell (Australia) and Philip Gwage (Uganda) would co-chair a contact group,other
2003,240,CHILE,stressed,the need to call on national governments to provide financial resources to national meteorological authorities,support
2003,244,G-77/CHINA,said they would consult internally,consult internally,support
2003,263,FINLAND,said,Outi Berghäll (Finland) and Marcela Maim (Chile) would conduct informal consultations on draft SBSTA conclusions,other
2003,263,CHILE,said,Outi Berghäll (Finland) and Marcela Maim (Chile) would conduct informal consultations on draft SBSTA conclusions,other
2003,265,EUROPEAN UNION,said,a workshop co-organized by the CCD and CBD on identifying and promoting synergies through forest and forest ecosystems would be held in March 2004,other
2003,271,CANADA,expressed hope,progress would be made in the future,support
2003,286,UK,outlined,the background and outcomes of the third expert meeting,other
2003,293,BULGARIA,was chaired by,SBI,other
2003,300,EUROPEAN UNION,emphasized,the need to discuss the implementation of decision 5/CP,support
2003,300,USA,emphasized,the need to discuss the implementation of decision 5/CP,support
2003,301,G-77/CHINA,proposed,the agenda sub-item not be restricted to decision 5/CP,support
2003,301,CHINA,proposed,the agenda sub-item not be restricted to decision 5/CP,support
2003,310,USA,suggested,non-Annex I national communications should be submitted no more than four years after the submission of their initial communications,support
2003,315,G-77/CHINA,noted,the preparation of national communications is a continuous process,other
2003,318,EUROPEAN UNION,proposed,text that national communications assist the COP to review the UNFCCC’s implementation,support
2003,320,G-77/CHINA,suggested,frequency of submissions of national communications shall be dependent on the availability of funding,support
2003,321,EUROPEAN UNION,Available,The EU,other
2003,322,CHINA,underlined that it would not discuss the issue of frequency of submissions,the issue of frequency of submissions,support
2003,323,USA,The,US,other
2003,341,CHINA,urged the establishment of,a procedure for the replenishment of the SCCF,support
2003,344,COLOMBIA,Available,Colombia,other
2003,345,G-77/CHINA,underscored,addressing sources of finance and mechanisms for dispersal,support
2003,346,FEDERATED STATES OF MICRONESIA,stressed,the need for expedited access,support
2003,348,NIGERIA,Available,Nigeria,other
2003,349,EUROPEAN UNION,Available,The EU,other
2003,351,G-77/CHINA,said that the SCCF should be financed from new and additional funds,the SCCF should be financed from new and additional funds,support
2003,352,G-77/CHINA,Available,The G-77/China,other
2003,356,G-77/CHINA,expressed concerns that the draft decision had not incorporated elements regarding the predictability and the new and additional nature of the funding,the draft decision had not incorporated elements regarding the predictability and the new and additional nature of the funding,opposition
2003,359,EUROPEAN UNION,Opposing,a proposal by the EU to include references to the Millennium Development Goals (MDGs),opposition
2003,360,CANADA,proposal to use non-Annex I national communications as the basis for defining adaptation and technology transfer priorities,use non-Annex I national communications as the basis for defining adaptation and technology transfer priorities,support
2003,362,EUROPEAN UNION,Available,The EU,other
2003,363,G-77/CHINA,proposed,alternative text regarding the prioritization of,support
2003,363,CHINA,proposed,alternative text regarding the prioritization of,support
2003,366,G-77/CHINA,Available,The G-77/China,other
2003,375,TANZANIA,Available,Tanzania,other
2003,376,CHINA,urged,accelerated funding for second national communications,support
2003,376,BRAZIL,urged,accelerated funding for second national communications,support
2003,382,COLOMBIA,requested,conduct informal consultations with the relevant contact group chairs,support
2003,393,G-77/CHINA,Available,The G-77/China,other
2003,404,COP,decides to,complete the first comprehensive review of the implementation of the framework for capacity building in developing countries by COP-10,support
2003,404,COP,decides to,conduct further comprehensive reviews every five years thereafter,support
2003,404,COP,decides to,request the Secretariat to prepare a technical paper on the range and effectiveness of capacity-building activities in developing countries for consideration by SBI-20,support
2003,404,COP,decides to,invite Parties to submit to the Secretariat,support
2003,409,SWITZERLAND,requested,to conduct informal consultations and prepare draft conclusions,support
2003,411,GAMBIA,reported,on the informal consultations,other
2003,421,SAUDI ARABIA,underscored the need to take immediate action,take immediate action,support
2003,423,G-77/CHINA,Opposed by,the G-77/China,opposition
2003,423,CHINA,Opposed by,the G-77/China,opposition
2003,431,LDCs,relating to,the matter of UNFCCC Article 4,other
2003,434,TANZANIA,Available,Richard Muyungi,other
2003,435,BANGLADESH,Available,Bangladesh,other
2003,436,BURKINA FASO,would facilitate informal consultations on this matter and prepare a draft COP decision,informal consultations on this matter and prepare a draft COP decision,support
2003,471,EUROPEAN UNION,underlined,the importance of adequate and secure resources,support
2003,472,USA,opposed,the inclusion of the development costs of the Protocol in the Secretariat’s core budget,opposition
2003,480,ARGENTINA,took note of a concern by,the scales of assessment,other
2003,489,CROATIA,Proposal by,Croatia on LULUCF and special circumstances of Croatia under UNFCCC Article 4,support
2003,491,UK,After informal consultations undertaken by,informal consultations,other
2003,492,CROATIA,Conclusions: In the conclusions on the special circumstances of,Croatia under Article 4,other
2003,493,SBI,notes,the information provided by Croatia on anthropogenic emissions by sources and removals by sinks,other
2003,499,EUROPEAN UNION,said,only the COP/MOP has authority to decide on the issue,other
2003,503,SBI,notes,the submission by Belarus to use 1990 as its base year,other
2003,503,SBI,requests,the Secretariat to make available the report on the in-depth review of Belarus’ first national communication before SBI-20,support
2003,514,SAUDI ARABIA,Available,Saudi Arabia,other
2003,518,JAMAICA,was elected COP Rapporteur,COP Rapporteur,support
2003,518,LIBYA,was elected Chair of SBSTA,Chair of SBSTA,support
2003,524,G-77/CHINA,expressed concern over,the increase in Annex I emissions,opposition
2003,524,G-77/CHINA,appealed for,political commitment,support
2003,525,ARGENTINA,Available,Available,other
2003,526,AOSIS,Available,,other
2003,527,ICELAND,called for,the application and transfer of existing technologies,support
2003,528,CHILE,said,José Ovalle (Chile) and Michael Zammit-Cutajar (Malta) would co-chair a contact group on this issue,other
2003,528,MALTA,said,José Ovalle (Chile) and Michael Zammit-Cutajar (Malta) would co-chair a contact group on this issue,other
2003,530,ARGENTINA,noted,omissions regarding the extent of delay in submission of documents,other
2003,531,USA,said,references to commitments under the Protocol may be premature,other
2003,533,EUROPEAN UNION,opposed by,the EU,opposition
2003,535,ARGENTINA,stressed,future discussions on this matter should include the need to have comparable methodologies for measuring greenhouse gas emission projections,support
2003,567,ITALIA,Speaking on behalf of Italy’s Prime Minister Silvio Berlusconi,,other
2003,577,MOROCCO,Available,Morocco,other
2003,578,BENIN,stressed,integrating poverty reduction and adaptation measures,support
2003,580,NEW ZEALAND,underlined,the vulnerability of SIDS,support
2003,580,NEW ZEALAND,noted,threats to island cultures,support
2003,581,SLOVENIA,Available,,other
2003,583,PANAMA,said,adaptation should be given the same status as mitigation under the UNFCCC,support
2003,585,ARGENTINA,called for,a mechanism to facilitate adaptation projects,support
2003,587,RUSSIA,said that remaining uncer- tainties regarding whether mitigation efforts will be effective for reducing climate change justify pursuing adaptation,remaining uncer- tainties regarding whether mitigation efforts will be effective for reducing climate change justify pursuing adaptation,support
2003,588,BURKINA FASO,questioned the purpose of,NAPAs if mechanisms for their implementation are not in place,other
2003,589,CHINA,said,once developed countries have taken the lead in mitigating emissions,other
2003,590,AUSTRIA,stated that,nuclear power is not an option for combating climate change,support
2003,591,NEPAL,said that despite his country’s insignificant contribution to climate change,insignificant contribution to climate change,other
2003,593,FRANCE,emphasized,this century will either be recorded as the century of climate change suffering and collective irresponsibility or the century of climate control and the maturing of humanity,support
2003,594,SAUDI ARABIA,said that,mitigation and adaptation measures must not lead to new commitments for developing countries,support
2003,602,REPUBLIC OF IRELAND,Available,Ireland,other
2003,603,BURUNDI,expressed concern over,access to data from developed countries,opposition
2003,604,ICELAND,called for,vision,support
2003,605,INDIA,expressed concern that the only concrete outcome of calls for technology transfer is,TT:CLEAR,opposition
2003,606,RWANDA,said,donors must address the need for poverty reduction when transferring technologies,support
2003,607,INTERNATIONAL WORK GROUP FOR INDIGENOUS AFFAIRS (IWGIA),called for,greater participation and securing indigenous peoples’ prior informed consent when undertaking action,support
2003,609,SWEDEN,said,policy-makers should focus on equity issues and modalities for the adoption of technologies at local levels,support
2003,611,SPAIN,urged,the establishment of institutional frameworks to facilitate investment by the private sector in projects that promote sustainable development,support
2003,614,SOUTH KOREA,Available,The Republic of Korea,other
